{
  "benefit": "Школа рядом и детский сад рядом могут упростить семейную логистику; расстояние и наличие мест лучше проверить отдельно.",
  "caveat": "Тип и состояние площадки пока не уточнены.",
  "fact_summary": "По этому варианту указаны школа рядом, детский сад рядом и детская площадка.",
  "final_question": "Хотите подробнее разобрать этот вариант?",
  "intro": "Да, этот вариант можно спокойно рассмотреть для семейного сценария.",
  "used_combination_ids": [
    "school_plus_kindergarten"
  ],
  "used_field_ids": [
    "school",
    "kindergarten",
    "children_ground"
  ]
}
